{
  "schema_version": "3.0.0",
  "steering_id": "fixture-steering-id",
  "scope": {
    "tenant_id": "fixture-tenant",
    "project_id": "fixture-amplai"
  },
  "goal_id": "fixture-goal-id",
  "actor": {
    "subject_id": "test-worker",
    "kind": "service",
    "authn_context_ref": "test-authn"
  },
  "expected_contract_ref": {
    "id": "fixture-ref",
    "revision": 1,
    "digest": "sha256:bc87b130fe6e2fb0156bdda50d7d14562db83b58199490694266def47b41773d"
  },
  "kind": "pause",
  "text": "fixture-text",
  "evidence_refs": [],
  "status": "received",
  "native_turn_id": null,
  "effective_contract_ref": null,
  "received_at": "2026-09-15T13:30:00Z"
}
